college,title,description
KHC,KHC AH 101: (MIS)REPRESENTING HISTORY IN ART,"An examination of the ways that historical events have been depicted by artists from antiquity to the present, with an emphasis on the intentional misrepresentation of events (""fake news"") to serve the needs of the artists' patrons, usually ruling elites. Effective Fall 2018, this course fulfills a single unit in each of the following BU Hub areas: Aesthetic Exploration, Historical Consciousness."
KHC,KHC AH 103: Experimental Art,"This seminar investigates how visual and performance artists have wildly expanded our definition of what art is, including an exploration of new techniques, theories, markets, and political implications of art in the 20th and 21st centuries. How Does Art Happen? Who Is Art For? How Do You Make Art History? We will consider artists that challenged viewers' and philosophers' ideas about what makes something a work of art. These experimental artworks brought new people into the story of art history, expanding our understanding of who can be an artist (all of us). Effective Fall 2023, this course fulfills a single unit in each of the following BU Hub areas: Philosophical Inquiry and Life's Meanings, Aesthetic Exploration, Creativity/Innovation."
KHC,"KHC AM 101: Whose Schools: Power, Equality and Public Education","How can we fulfill Thomas Jefferson's promise for public schools ""which shall reach every description of our citizens?"" The course examines significant eras, debates, and struggles for equality in U.S. education, with a particular focus on current policies in Boston. Effective Fall 2019, this course fulfills a single unit in each of the following BU Hub areas: Social Inquiry II, The Individual in Community, Research and Information Literacy."
KHC,"KHC AN 102: The Lives of Others: The Power, Politics, and Ethics of Storytelling","This course delves into the ethical and political dimensions of storytelling, explores various cultural and historical forms of storytelling, and examines the deployment of storytelling in applied contexts such as narrative medicine. Effective Fall 2018, this course fulfills a single unit in each of the following BU Hub areas: Social Inquiry I, Global Citizenship and Intercultural Literacy, Teamwork/Collaboration."
KHC,KHC AN 103: Animals among Humans,"This course, ""Animals among Humans,"" complements a hitherto existing course, KHC AN 101, Human among Animals."" Comparing and contrasting humans and (other) animals, It explores the relations between them, with emphasis on the experiences of the nonhuman animals themselves. [The other course, Humans among Animals, also explores human-animal comparisons, contrasts, and interactions, but it does so with emphasis on the experiences of the humans involved.] Effective Fall 2018, this course fulfills a single unit in each of the following BU Hub areas: Historical Consciousness, Global Citizenship and Intercultural Literacy, Critical Thinking."
KHC,KHC AN 104: Wildlife Conservation,"Through team-based approaches, students learn about threats to wildlife and natural habitats, identifying community-based root causes. They apply their own disciplinary expertise and passions to develop creative solutions to these problems, culminating in the production of a final conservation video. Effective Spring 2021, this course fulfills a single unit in each of the following BU Hub areas: Digital/Multimedia Expression, The Individual in Community, Creativity/Innovation."
KHC,KHC AN 105: Conflict: The Human Condition,"What can we learn about the human condition when we think through conflict? Unlike premodern forms of political authority and social organization, modern sociopolitical forms sanction specific forms of adversarial interaction as positive, regulative forces while banning forms of conflict as unwanted, corrosive influences on sociopolitical order. Students will engage with a rich array of multidisciplinary writings on human conflict as well as theatrical, literary, and cinematic takes on the primacy of adversarial relations for understanding the human condition. Effective Fall 2023, this course fulfills a single unit in each of the following BU Hub areas: The Individual in Community, Social Inquiry I, Critical Thinking."
KHC,KHC EC 103: Housing Policy: An Economic Perspective,"This course introduces students to economic analysis through the study of housing policy. The course covers both microeconomic issues related to housing affordability and macroeconomic issues related to the stabilization of the housing market and the Great Recession. Throughout, the course will teach students economic principles and how use data to assess economic arguments. Effective Fall 2018, this course fulfills a single unit in each of the following BU Hub areas: Social Inquiry II, Quantitative Reasoning II, Research and Information Literacy."
KHC,KHC EH 103: Race in America: Understanding the Present by Exploring the Past,"Course explores how contemporary racial crises have surprising histories and deep roots in America's cultural imagination. Slave owning in New England? ""Black Lives Matter"" and 100-year old Confederate memorials? Books, movies, TV drama, journalism today and their urgent historical background. Effective Fall 2018, this course fulfills a single unit in each of the following BU Hub areas: Aesthetic Exploration, Historical Consciousness, Research and Information Literacy."
KHC,KHC EK 104: Appreciation of music in a STEM context,"This course leverages the relationship that students, who are not averse to STEM fields, have with music in order to turn them into GEEKS! It uses the electric guitar as a gateway to musical acoustics, electroacoustics, psychoacoustics and hands-on projects. No formal music training is required; the only prerequisites are the ability to appreciate music in some vaguely defined sense, and to try understand this appreciation with precise terms. The course will be supported by field trips, demos and projects. Effective Spring 2021, this course fulfills a single unit in each of the following BU Hub areas: Aesthetic Exploration, Quantitative Reasoning II, Creativity/Innovation."
KHC,KHC EN 102: Ancient and Modern Quarrels: Fiction and Philosophy Since 1900,"The ""ancient quarrel"" between literature and philosophy. Ancient works by Sophocles, Plato, Aristotle; existentialist writing by Kierkegaard, Nietzsche, Sartre, De Beauvoir, Ellison; contemporaries such as Sontag, Robinson, Coetzee. What good is art and narrative? What are their powers, limits, dangers? Effective Fall 2018, this course fulfills a single unit in each of the following BU Hub areas: Aesthetic Exploration, Philosophical Inquiry and Life's Meanings, Critical Thinking."
KHC,KHC EN 103: Poetry as Activism,"Do artists have a responsibility to bear witness to their times? This course explores the work of contemporary poets who directly engage the current moment, who show us that art can function as political action. Among the controversial topics that these authors draw attention to and comment on are racial injustice, mass incarceration, war, LGBTQ rights, immigration policy, and environmental devastation. Through our course texts and students' own poems, we will consider the ethics of appropriation and representation, as well as the use of personal experience and found documents in poetry. Effective Fall 2018, this course fulfills a single unit in each of the following BU Hub areas: Aesthetic Exploration, The Individual in Community, Creativity/Innovation."
KHC,KHC EN 104: Writing Lives: The Craft and Forms of Literary Biography,"Literary writers craft characters. Many were characters as well--in their own lifetime and after their deaths. In this course, we explore the character of the writer as portrayed in multiple genres including fiction, essay, biography, autobiography, obituaries, and docudramas. We ask how does our perception of an artist change over time? How might literary biography serve as a lens to discuss changing conceptions of creativity, trends in historiography, and the development of literary canons? Our four case studies focus on Emily Dickinson, Louisa May Alcott, Toni Morrison, and Sylvia Plath. Effective Spring 2020, this course fulfills a single unit in each of the following BU Hub areas: Aesthetic Exploration, Research and Information Literacy, Creativity/Innovation."
KHC,KHC FT 102: UnAmerican Cinema,"This course seeks to understand American film history in light of one set of events: the House Un-American Activities Committee hearings on communism in the film industry and the resulting industry blacklist. Effective Fall 2018, this course fulfills a single unit in each of the following BU Hub areas: Aesthetic Exploration, Historical Consciousness, Research and Information Literacy."
KHC,KHC FT 103: Screenwriting: Doing Justice Through Adaptation,"Undergraduate Prerequisites: First Year Writing Seminar (e.g., WR 100 or WR 120). - This course will analyze the responsibilities of adapting socially significant source material for the screen. The lessons from case studies will assist students in their effort to identify impactful source material, research related topics, and develop a screenplay adaptation. Effective Fall 2018, this course fulfills a single unit in each of the following BU Hub areas: Aesthetic Exploration, Writing-Intensive Course, Creativity/Innovation."
KHC,KHC HC 301: Interdisciplinary Perspectives on Global Challenges I,"In this course, students will develop an understanding of global public health from interdisciplinary perspectives. Specifically, the course will foster students’ ability to critically consider key contemporary issues in global public health with a lens on ethical considerations, and in turn make links to policy and practice implications. Students will take on a range of issues that go well beyond the study of public health itself, raising questions such as those around identity, childhood, mental health, historical legacies of colonialism, and contemporary inequalities.  This course fulfills a single unit in each of the following BU Hub areas: Historical Consciousness, Ethical Reasoning, Critical Thinking."
KHC,KHC HC 302: Interdisciplinary Perspectives on Global Challenges II,"68.5 million people were displaced from their homes by wars and persecution by the end of 2017. What disciplines and methodologies will help us understand this unprecedented global crisis? A premise of this course is that any understanding of the contemporary refugee crisis requires interdisciplinary study, and the most effective solutions are developed by teams like the interdisciplinary groups you will form in this class. The refugee crisis will provide a lens through which to understand nation/states, culture, identity, technology, trauma, and human resilience. Effective Spring 2020, this course fulfills a single unit in each of the following BU Hub areas: Social Inquiry II, Global Citizenship and Intercultural Literacy, Teamwork/Collaboration."
KHC,KHC HC 401: Epistemologies and the Process of Inquiry,"This course introduces students to a variety of research methodologies, including qualitative and quantitative research techniques, data analysis and visualization, and interdisciplinary strategies relevant to students in all disciplines. The course material will be couched in a provocative current issue, such as urban development or gun violence in an effort to engage students in robust conversation. Effective Fall 2019, this course fulfills a single unit in each of the following BU Hub areas: Quantitative Reasoning II, Research and Information Literacy, Teamwork/Collaboration."
KHC,KHC HC 451: Kilachand Keystone Proposal Workshop,"Undergraduate Prerequisites: First Year Writing Seminar (e.g., WR 100 or WR 120), 3.0 cumulative GP A, B or better in prior Kilachand coursework. - KHC HC 451 will take students through the process of writing a research question or goal, doing preliminary research and writing an annotated bibliography, designing a feasible project, securing an advisor, and producing a convincing Keystone Project Proposal. Students will learn how to present the significance of their projects in clear language that non-specialists can understand. The Keystone Project Proposal is required of all students pursing the Kilachand Keystone Project, and is optional for students fulfilling the Kilachand Research Requirement through other pathways. Effective Fall 2020, this course fulfills a single unit in the following BU Hub area: Writing- Intensive Course."
KHC,KHC HC 501: People in Process: Lives & Works,"Students discuss case studies that highlight the impact of innovative research on culture and examine the major challenges that face our society, from access to higher education to health care to race and gender in the workplace. The course also supports students ongoing work on their senior projects. Effective Fall 2020, this course fulfills a single unit in the following Hub area: Philosophical Inquiry and Life's Meanings."
KHC,KHC HC 502: People in Process: Choice and Change - Writing Intensive,"Undergraduate Prerequisites: First Year Writing Seminar (e.g., WR 100 or WR 120) - Explores the challenges, choices, and influence of an individual who has had an impact on the student's educational decisions by crafting written arguments with attention to modes of expression and range of genres. Effective Fall 2020, this course fulfills a single unit in the following BU Hub area: Writing- Intensive Course."
KHC,KHC HC 503: Keystone Independent Study I,"All Kilachand students complete a substantial work of empirical or scholarly research, creativity, or invention by the close of their senior year. Kilachand students enroll in KHC HC 503 as an independent study with their Keystone Project advisor in the fall of their senior year. Effective Fall 2021, this course fulfills a single unit in the following BU Hub area: Creativity/Innovation."
KHC,KHC HC 504: Keystone Independent Study II,"All Kilachand students complete a substantial work of empirical or scholarly research, creativity, or invention by the close of their senior year. Kilachand students enroll in KHC HC 504 as an independent study with their Keystone Project advisor in the spring of their senior year. Effective Spring 2022, this course fulfills a single unit in the following BU Hub area: Creativity/Innovation."
KHC,KHC HC 512: People in Process: Choice & Change - Oral/Signed Communication,"Explores the challenges, choices, and influence of an individual who has had an impact on the student's educational decisions through oral communication with attention to argumentation and public speaking. Effective Spring 2021, this course fulfills a single unit in the following BU Hub area: Oral and/or Signed Communication."
KHC,KHC HC 522: People in Process: Choice & Change - Digital/Multimedia Expression,"Explores the challenges, choices, and influence of an individual who has had an impact on the student's educational decisions through digital/multimedia design with attention to argumentation and communication technologies. Effective Spring 2021, this course fulfills a single unit in the following BU Hub area: Digital/Multimedia Expression."
KHC,KHC HI 102: The Culture of World War I,"Studies World War I through works of literature, art, and music. Themes include initial optimism, the brutal reality of the trenches, and consequences of the peace. Works by Owen, Sassoon, Brooke, Kandinsky, Picasso, Grosz, Stravinsky, Butterworth, Freud, West, Junger, Celine. Effective Fall 2018, this course fulfills a single unit in each of the following BU Hub areas: Aesthetic Exploration, Historical Consciousness."
KHC,KHC HI 104: Urban Youth in the Middle East,"Examines social, economic, political, religious, and gender issues urban youth in the Middle East face in the 21st century given the escalation of violence and the stark economic inequalities impinging upon them, but also the many new opportunities available. Effective Fall 2019, this course fulfills a single unit in each of the following BU Hub areas: Historical Consciousness, Global Citizenship and Intercultural Literacy, Critical Thinking."
KHC,KHC HI 105: The Zapatista Rebellion,"This course will study the Zapatista Rebellion in Chiapas, Mexico, 1994--2010. Out of what processes and conditions did it grow, with what actions and imaginaries on the part of indigenous activists and communities, as well as their allies and opponents? Studying one major historical event in depth will enable us to consider different ways of seeing and interpreting the event and to consider what it means to undertake wide-ranging social inquiry. Effective Fall 2023, this course fulfills a single unit in each of the following BU Hub areas Digital/Multimedia Expression, Social Inquiry I, Critical Thinking."
KHC,KHC HI 107: Global History of a Movement,"It is difficult for us in our historical moment to discern the degree to which the social, political, economic, and intellectual life of the world was riven by conflicts between competing ideologies/movements as they imagined the future of the global system. Through careful attention to our shared archives of art, fiction, and primary-source texts, this course will explore movements like communism, feminism, and decolonization across time and space in order to understand these movements as global phenomena that continue to structure the unfolding of history in our present. Effective Fall 2023 this course fulfills a single unit in each of the following BU Hub areas: Aesthetic Exploration, Historical Consciousness, Research and Information Literacy."
KHC,KHC IR 102: Spies and Terrorists of Boston,"Using an interdisciplinary approach, this course will examine various important, impactful, and, in some ways, underappreciated espionage activities and terrorist events that germinated, received support, or otherwise occurred in the Boston metropolitan area. Please note: This course requires students to (1) take a mandatory four-hour field trip of Boston spy sites with the professor on a weekend and (2) participate in three one-hour oral briefing practice sessions with the professor to be scheduled in the evenings outside of class. Effective Fall 2020, this course fulfills a single unit in each of the following BU Hub areas: Oral and/or Signed Communication, Ethical Reasoning, Teamwork/Collaboration."
KHC,"KHC LW 102: Marriage, Families & Gender: Contemporary Legal and Social Controversies","This seminar will critically examine the family, marriage, and gender by asking several basic questions: What is family? What is marriage? Why do family and marriage matter to individuals and to society? What role does or should law have in supporting and regulating families and marriage? In defining parenthood? How do new technologies that provide new pathways to parenthood (assisted reproductive technology, or ""ART"") and new forms of control over reproduction (such as genetic testing and screening) pose ethical and legal challenges and how should law address those challenges? Effective Fall 2018, this course fulfills a single unit in each of the following BU Hub areas: Ethical Reasoning, Social Inquiry II, Critical Thinking."
KHC,"KHC LW 104: Citizenship, Immigration, and the Constitution","In this seminar, we will examine constitutional questions concerning (1) the acquisition and loss of citizenship status, and (2) the privilege or right of entry into the United States. Throughout, we will consider the ethical and constitutional principles that have shaped rules governing national membership and entry into the United States. Effective Spring 2022, this course fulfills a single unit in each of the following BU Hub areas: Ethical Reasoning, Social Inquiry I, Critical Thinking."
KHC,"KHC MD 101: Fractured Lives and Bodies: Forensic Anthropology, Disasters, and Human Rights","This course will explore the roles and responsibilities of forensic anthropology - a sub-discipline of anthropology that addresses medico-legal issues - in the context of global disasters, forced and voluntary displacements and migrations, and human rights. Namely, what are the varied geopolitical contexts in which forensic anthropologists participate in humanitarian response? What are the ethical issues involved in humanitarian work? How does forensic science in global human rights contexts differ from local applications? How can forensic anthropology contribute to post- disaster recovery? Effective Fall 2018, this course fulfills a single unit in each of the following BU Hub areas: Scientific Inquiry I, Global Citizenship and Intercultural Literacy, Critical Thinking."
KHC,"KHC MU 104: Race, Gender, Music, and the Making of Latin America","Students will examine the relationship between musical practice and ideas of race and gender in Latin America from the 16th century to the present day, with particular focus on the process by which music is enlisted in nationalist projects. They will consider the ways in which music dramatizes gender roles and relations -- of attraction, repulsion, and separation -- among people of European, African, Amerindian, and mixed descent in Latin American societies and discover music's role in projects of missionization, racial ""whitening,"" cultural nationalism, and cultural tourism. Effective Fall 2018, this course fulfills a single unit in each of the following BU Hub areas: Historical Consciousness, Global Citizenship and Intercultural Literacy, Research and Information Literacy."
KHC,"KHC NE 102: Reading, Language, and the Brain","This course explores the scientific study of reading and language development--a richly multidisciplinary effort that bridges psychology, linguistics, neuroscience, and education--emphasizing the modern scientific effort to understand ""the reading brain"", the coordination of neural systems for vision, hearing, language, and memory. Specific topics include the history of writing, how different writing systems produce different reading brains, how brain injuries can result in specific impairments in language and reading, and how brain imaging is helping unravel the mystery of reading impairment. Effective Fall 2018, this course fulfills a single unit in the following BU Hub areas: Scientific Inquiry I, Social Inquiry I, Critical Thinking."
KHC,KHC NE 104: VISION & ART,"The course will guide students to learn about the neuroscience and neurology of eye and brain functions and disfunction and will discuss their relationship paintings. We will discuss the effect of eye and retinal diseases on the painting of Degas, Monet, ElGreco, Georgia O'Keefe, and the blind Turkish painter (E.Armagan) who sees by touch. Impairments of cortical visual functions will be associated with discussion of the paintings of great masters such as Rembrandt, Bacon, and Van Gogh. Virtual and real visits to Art Museums. Effective Spring 2022, this course fulfills a single unit in each of the following BU Hub areas: Aesthetic Exploration, Scientific Inquiry I, Teamwork/Collaboration."
KHC,KHC PH 103: Seeing Poverty,"How do we understand poverty in modern America? Images of poverty might lead us to believe poverty is exclusively a problem of urban people of color, but what do historic and modern depictions of poverty in popular culture -- reality TV shows, or films tell us? How is data on poverty calculated and understood? This course will explore the ever-changing and ever-political sociological and public health issues of measuring poverty in America today. Using literature, film, photography, and public data sets, the course will explore the true meaning of ""poverty."" Effective Fall 2018, this course fulfills a single unit in each of the following BU Hub areas: Social Inquiry I, The Individual in Community, Critical Thinking."
KHC,KHC PH 104: Planning to Fix Health Problems,"U.S. health care suffers anarchy because market competition and competent government action fail. Costs rise. Coverage and quality fall. You'll learn to prepare a plan to ameliorate a health problem by analyzing both its real causes and the efficacy/cost/political feasibility of possible remedies. Effective Fall 2018, this course fulfills a single unit in each of the following BU Hub areas: Social Inquiry I, Quantitative Reasoning I."
KHC,KHC PO 102: How to Change the World,"Explores how everyday people shape global politics, drawing on classic studies of political anthropology as well as more recent examples of transnational and digital activism. Effective Fall 2018, this course fulfills a single unit in each of the following BU Hub areas: Historical Consciousness, Oral and/or Signed Communication, Research and Information Literacy."
KHC,KHC PO 103: Democracy and Capitalism in the United States,"In this class, we will look at the relationship between capitalism and democracy in the United States. In what ways are capitalism and democracy complementary? In what ways are they in contraction? To address these questions, we will explore some of the philosophical and historical roots of both concepts through a series of case studies. Effective Fall 2020, this course fulfills a single unit in each of the following BU Hub areas: Digital/Multimedia Expression, Philosophical Inquiry and Life's Meanings, Teamwork/Collaboration."
KHC,KHC PO 104: War and Memory in the American Experience,"This seminar examines three questions: How do we remember (and forget) war? Who does the remembering? What is the relationship between war memory and war making? The relationship between war and memory is explored via the American experience. Effective Spring 2023, this course fulfills a single unit in the following BU Hub areas: Historical Consciousness, Individual in Community, Creativity & Innovation"
