college,title,description
MET,MET LX 511: Morphology: Introduction to the Structures and Shapes of Words,"Prereq:(METLX250) or consent of instructor. *Morphology, the study of the internal structure and the shapes of words across languages, straddles the boundary between syntax and phonology. This course covers the major empirical and theoretical issues in the study of morphology, emphasizing links to other components of grammar."
MET,"MET LX 517: ""Having"" and ""Being"" across Languages","Prereq:(METLX250) or consent of instructor. *Languages differ startlingly in how they express the apparently basic concepts of ""possession"" and ""essence"". Students explore this variety and its implications, addressing fundamental questions about linguistic relativism, language universals, and the relationship between structure and meaning."
MET,MET LX 521: Syntax: Introduction to Sentential Structure,"Prereq:(METLX250) or consent of instructor. *Introduction to syntax as an object of inquiry. Students build an increasingly sophisticated model of syntactic knowledge to account for data from English and other languages, constructing and evaluating alternative hypotheses about how sentence structure works."
MET,MET LX 522: Intermediate Syntax: Modeling Syntactic Knowledge,"Prereq: MET LX 521, or consent of instructor. *Using linguistic data drawn from a wide variety of languages, students develop a precise model of syntactic knowledge through evaluation of hypotheses and arguments. Exploration of major discoveries and phenomena from the linguistic literature."
MET,MET LX 528: Questions,"Exploration of question formation across languages, and from several theoretical perspectives, integrating syntax, phonology, semantics, morphology, pragmatics, and philosophy in pursuit of a general understanding of one of the central phenomena in theoretical linguistics."
MET,MET LX 531: Semantics & Pragmatics: Introduction to Linguistic Meaning,"Prereq: (METLX250) or consent of instructor. Systematic examination of how meaning is encoded in words and sentences, and how it can emerge from the complexity of the grammar. This course also touches on various aspects of pragmatics--the study of how meaning is shaped by context. Effective Fall 2019, this course fulfills a single unit in each of the following BU Hub areas: Individual in Community, Global Citizenship and Intercultural Literacy, Critical Thinking."
MET,MET LX 532: Intermediate Semantics: The Grammatical Construction of Meaning,"Undergraduate Prerequisites: CAS LX 331 (formerly CAS LX 502); Graduate Prerequisites: GRS LX 631 (formerly CAS LX 502), or consent of instructor. - Systematic development of a semantic theory of natural language, using the tools of model-theoretic semantics. In-depth study of the relation between meaning and grammar, and the relation between meaning and context. Also offered as CAS LX 732."
MET,"MET LX 542: Language, Race, and Gender","Prereq: (METLX250) or consent of instructor. Do women talk differently from men? How do race and ethnicity relate to the way people use language? This course examines these interrelated questions from the perspective of modern sociolinguistic theory, analyzing a range of languages and communities throughout the world. Effective Fall 2019, this course fulfills a single unit in the following BU Hub areas: Social Inquiry I, Teamwork/Collaboration."
MET,MET LX 546: Language Variation and Change,"Prereq:(METLX250) or consent of instructor. Why do languages change over time? Who leads and who follows in situations of language change? The course answers these questions by examining the link between language change and linguistic variation, focusing on how synchronic variation leads to diachronic change. Effective Fall 2019, this course fulfills a single unit in each of the following BU Hub areas: Social Inquiry I, Teamwork/Collaboration."
MET,MET LX 549: Bilingualism,"Prereq: (METLX250) or consent of instructor. The psycholinguistics and sociolinguistics of life with two languages. Topics include bilingual language use, processing, acquisition, organization; effects of bilingualism on cognition and development; the bilingual brain; the bilingual speech community; bilingual education; bilingualism in the media and public eye. Carries humanities divisional studies credit in CAS. Effective Fall 2019, this course fulfills a single unit in each of the following BU Hub areas: Social Inquiry II, Individual in Community, Critical Thinking."
MET,MET LX 560: Historical and Comparative Linguistics,"This course explores different approaches to historical linguistics, the study of language change. We will discuss various types of linguistic change (phonological, morphological, semantic, and syntactic) and the methods used to investigate these changes. Throughout the course we will address the contribution of historical linguistics to understanding prehistory. Another important topic of this course is linguistic reconstruction (reconstruction of protolanguages), its methods and goals. We also explore the social and linguistic motivations for linguistic change. Finally, we will consider language contact and borrowing and genetic/genealogical classification of languages."
MET,MET LX 565: Variation in Dialects of English,"Prereq:(METLX250) or consent of instructor. *Exploration of how dialects of English differ from each other, focusing on grammatical variation in the US, with occasional forays into British dialects. Students come to appreciate how linguists investigate grammatical diversity scientifically, revealing the complex structure of non-standard dialects."
MET,MET LX 591: Linguistic Field Methods,"A team-based in-depth investigation of the phonology, morphology, syntax, semantics, and lexicon of an African or other non-Indo-European language. Bi-weekly sessions with language consultant. Weekly trainings on methodology, ethics, analysis, and presentation of results. Effective Spring 2021, this course fulfills a single unit in each of the following BU Hub areas: Ethical Reasoning, Global Citizenship and Intercultural Literacy, Teamwork/Collaboration."
MET,MET LX 596: Computational Linguistics,"Prereq:(METLX250) or consent of instructor. Introduction to computational techniques to explore linguistic models and test empirical claims. Serves as an introduction to concepts, algorithms, data structures, and tool libraries. Topics include tagging and classification, parsing models, meaning representation, corpus creation, information extraction. [Students who have already taken CAS LX 394/GRS LX 694 are not eligible to take this course.] Effective Fall 2019, this course fulfills a single unit in each of the following BU Hub areas: Quantitative Reasoning II, Research and Information Literacy."
MET,MET MA 113: Elementary Statistics,"Undergraduate Prerequisites: (METMA100) or equivalent. - MA 113 may not be taken for credit by any student who has completed any MA course numbered 300 or higher. Students may receive credit for not more than one of the following courses: MET MA 113, MA 213, or CAS MA 113, MA 115, or MA 213. Basic concepts of estimation and tests of hypotheses, ideas from probability; one-, two-, and multiple-sample problems. Applications in social sciences. Primarily for students in the social sciences who require a one- semester introduction to statistics, others should consider CAS MA 115 or MA 213. This course fulfills a single unit in the following BU Hub area: Quantitative Reasoning II. Effective Fall 2020, this course fulfills a single unit in each of the following BU Hub areas: Quantitative Reasoning II, Critical Thinking."
MET,MET MA 120: Applied Mathematics for Social and Management Sciences,"Linear equations, systems of linear equations, matrix algebra, exponential functions and logarithms, elements of differential calculus, optimization, probability. Applications in economics, finance, and management. Note: MET MA 120 may be taken for CAS credit. Effective Fall 2020, this course fulfills a single unit in each of the following BU Hub areas: Quantitative Reasoning II, Critical Thinking."
MET,MET MA 123: Calculus I,"Undergraduate Prerequisites: (METMA118) or equivalent. - Students may receive credit for either MET MA 121 or MA 123 or CAS MA 121 or MA 123, but not both. Limits; derivatives; differentiation of algebraic functions. Applications to maxima, minima, and convexity of functions. The definite integral; the fundamental theorem of integral calculus; applications of integration. Effective Fall 2020, this course fulfills a single unit in each of the following BU Hub areas: Quantitative Reasoning II, Critical Thinking."
MET,MET MA 124: Calculus II,"Undergraduate Prerequisites: Prereq: MET MA 121 or MA 123 or CAS MA 121 or MA 123. - Students may receive credit for not more than one of the following courses: MA 122, MA 124, MA 127, or MA 129. Logarithmic, exponential, and trigonometric functions. Sequences and series; Taylor's series with the remainder. Methods of integration. Calculus I and II together constitute an introduction to calculus of a function of a single real variable. Effective Fall 2020, this course fulfills a single unit in each of the following BU Hub areas: Quantitative Reasoning II, Scientific Inquiry II, Critical Thinking."
MET,MET MA 213: Basic Statistics and Probability,"Undergraduate Prerequisites: (METMA118) or equivalent. - Elementary treatment of probability densities, means, variances, correlation, independence, the binomial distribution, and the central limit theorem. Stresses understanding and theoretical manipulation of statistical concepts. Note: Credit will be given for only one of the following courses: MET MA 113 or MA 213. Effective Fall 2020, this course fulfills a single unit in each of the following BU Hub areas: Quantitative Reasoning II, Critical Thinking."
MET,MET MA 214: Applied Statistics,"Undergraduate Prerequisites: (METMA213) or consent of instructor. - Inference about proportions, goodness of fit, student's t-distribution, and tests for normality. Two-sample comparisons, regression and correlation, tests for linearity and outliers, residual analysis, contingency tables, and analysis of variance. Effective Fall 2020, this course fulfills a single unit in each of the following BU Hub areas: Quantitative Reasoning II, Critical Thinking."
MET,MET MA 581: Probability,"Graduate Prerequisites: (METMA225 OR CASMA225 OR CASMA230) - Basic probability, conditional probability, independence. Discrete and continuous random variables, mean and variance, functions of random variables, moment generating function. Jointly distributed random variables, conditional distributions, independent random variables. Methods of transformations, law of large numbers, central limit theorem."
MET,MET MA 582: Mathematical Statistics,"Graduate Prerequisites: (METMA581 OR CASMA381 OR CASMA581) - Interval estimation. Point estimation including sufficiency, Rao-Blackwell theorem, completeness, uniqueness, Rao-Cramer inequality, and maximum likelihood estimation. Tests of hypothesis: uniformly most powerful tests, uniformly most powerful unbiased tests, likelihood ratio test, chi-squared test, comparison of means and variances, ANOVA, regression, and some nonparametric tests."
MET,MET MA 603: SAS with Statistical Applications,"Undergraduate Prerequisites: MET or CAS MA 214 - Offers a unified and in-depth coverage of the statistical computer package SAS, and its statistical applications. Topics include the language of SAS, data formatting, creating and storing SAS data sets, file manipulations, macro procedure, and graphics. Also included are procedures for statistical techniques selected from analysis of variance, regression, factor analysis, scoring, and categorical data analysis. Several large data sets will be used as case studies emphasizing hands-on experience with SAS for Windows. Laboratory course."
MET,MET MG 202: Personal Financial Planning,"The development of personal investment strategies using money and credit. Securities and portfolio management, budgeting, insurance, taxes, retirement programs, and estate planning."
MET,MET MG 301: Introduction to Management,"A look at the management of an enterprise from the perspective of the chief executive officer. Covers the functions of organizing for successful management. Survey of theories and techniques. Examination of case studies. Effective Fall 2024, this course fulfills a single unit in each of the following BU Hub areas: Creativity/Innovation, Quantitative Reasoning II, Teamwork/Collaboration."
MET,MET MG 302: Introduction to American Management for International Students,"Provides an overview of American management, business organizations, and capitalism for the non-American student. An important aspect of this course is the inclusion of assignments designed to promote an understanding of the subject area as well as an improvement in English language and writing skills."
MET,MET MG 305: Principles of Marketing,"The organization and operation of marketing functions within individual firms. A look at methods of product determination, channels of distribution, and advertising and sales promotion. Administration of total marketing program. Readings, class discussions, lectures, and case analyses. Effective Fall 2023, this course fulfills a single unit in each of the following BU Hub areas Quantitative Reasoning II, Teamwork/Collaboration, Creativity/Innovation."
MET,MET MG 310: Business Communication,Organization and techniques for effective verbal and written communication in the business environment. Emphasis on developing communication skills through practical written and oral assignments.
MET,MET MG 315: Operations Management,"Undergraduate Prerequisites: METMA120 & METMA213 or equivalent. - Introduction to the operating functions of a firm. Emphasis on problem-solving skills using analytical techniques. Includes production planning and inventory control, quality control, forecasting, capacity planning, and work-study. Viewed from the aspect of management."
MET,"MET MG 410: Entrepreneurial Management: Starting, Innovating, and Managing Small-, Medium-, and Large-Sized Vent","Covers the four key elements of successful entrepreneurial management: choosing a business, organizing, financing, and marketing. Includes preparing a business plan, becoming an entrepreneur, raising venture capital, selling, negotiating, and building an effective organization. Topics given special consideration are the practice of innovation, the art of leadership, and how to relate talents to succeeding in an innovative managed venture and technology management."
MET,MET MG 411: Marketing Communications,"Undergraduate Prerequisites: MET MG 305 - Examines the tools and techniques of communications used in marketing products, ideas, or services. Focus on analyzing, designing, selecting, and evaluating marketing communication strategies."
MET,MET MG 415: Project Management,"An examination of project management concepts, including organizational forms, planning and control techniques, and the role of the project manager. Develops the skills vital to effective management of multidisciplinary tasks through lectures, case studies, and business simulations. Effective Fall 2020, this course fulfills a single unit in the following BU Hub area: Teamwork/Collaboration."
MET,MET MG 431: International Marketing,Organization of the marketing function in international business. How government policies and practices affect marketing. Comparative marketing strategies for doing business abroad. Examination of case studies.
MET,MET MG 435: Advertising,"Undergraduate Prerequisites: MET MG 305 - The structure and operating procedures of advertising agencies and corporate advertising departments in relation to marketing. Active student participation in learning how advertising strategies and concepts are developed and executed. Includes readings, development of advertising strategies, screenings, and analysis of contemporary advertising."
MET,"MET MG 448: Electronic Commerce, Systems, and Web Design","The first course in a two course sequence. This course combines (1) the practical aspect of Web design through the use of application software such as Dreamweaver to construct a commercial Web site with (2) a general overview of the marketing, supporting services, systems, security and business strategy issues facing commercial enterprises."
MET,MET MG 460: Senior Project I,The first course of two for completion of the senior project for the degree completion program.
MET,MET MG 472: Financial Concepts,"Undergraduate Prerequisites: (METMG471) - Emphasizes issues of accounting, finance, and economics that are important in most management contexts. Introduction to tools of financial analysis and the problems of financial management including cash, profitability, and capital budgeting. Various sources of corporate funds are considered - short-, intermediate-, and long-term arrangements . Stresses understanding financial statements, planning and control, cost and benefit evaluation, cash flow analysis, and capital budgeting. Effective Fall 2020, this course fulfills a single unit in each of the following BU Hub areas: Quantitative Reasoning II, Critical Thinking."
MET,MET MG 473: Quantitative and Qualitative Decision Making,"This is a basic level course combining the elements of quantitative and qualitative decision making for business. The course exposes the student to practical quantitative approaches to mathematical decision making as well as a wind variety of qualitative approaches for both the services and product industries. Emphasis is placed on the definition of the problem, analysis of the approaches available to solve the problem, an understanding of the limitations and strengths of these approaches as well as the resources necessary. The course additionally prepares the student with design and presentation skills necessary to organize the communications of stating the problem and its different solution or outcome possibilities when the rational for taking a particular course of action needs to be presented to others or the material is being prepared for others who will make business decisions based on the information."
MET,MET MG 503: Business in a Changing Society,"Undergraduate Prerequisites: Advanced standing or consent of instructor - An examination of the management process and the social environment in which organizations operate, including a discussion of the manager's responsibilities to employees, customers, stockholders, and society."
MET,MET MG 515: Negotiations and Organizational Conflict Resolution,"Graduate Prerequisites: advanced standing or consent of instructor. - A communications skills course designed to better understand the nature of conflict and its resolution through persuasion, collaboration, and negotiation. Students will learn theories of interpersonal and organizational conflict and its resolution as applied to personal, corporate, historical, and political contexts. Students will assess their own styles, skills, and values, and develop techniques to better resolve disputes, achieve objectives, and exert influence."
MET,MET MG 520: International Business Management,"Undergraduate Prerequisites: (METMG301) or consent of instructor. - Environmental, economic, political, and social constraints on doing business abroad. Examines the effects of overseas business investments on domestic and foreign economics; foreign market analysis and operational strategy of a firm; and development potential of international operations."
MET,MET MG 522: Consumer Behavior,"Undergraduate Prerequisites: MET MG305 & MET MA213 - A broad view of consumer attitudes, behavior, and decision-making processes. Uses computer and case studies to supplement text readings."
MET,MET MG 530: Business Strategy,"Graduate Prerequisites: (METFI302 & METMK301 & METMG301 & METOM301) - Policy problems of business organizations. Integrates the areas of marketing, finance, accounting, economics, and personnel into a managerial concept of business decision making."
MET,MET MG 541: The Innovation Process: Developing New Products and Services,"Addresses the specifics of new product and service development and factors such as market research and partnering that add value and bring innovation to commercial reality. Effective Fall 2020, this course fulfills a single unit in the following BU Hub area: Creativity/Innovation."
MET,MET MG 545: American Institutions and Culture,"This course is intended primarily for international students to introduce them to American institutions -- business, educational, and political in particular -- within the context of American history, popular culture, and society. Students will learn about the unique features of American management and enterprise. The Boston metropolitan area will play an important role in appreciating the overall historical and cultural context, as will contemporary issues, scholarship, and unfolding events in illustrating distinctive features of American life and commerce."
MET,MET MG 550: International Business Law and Regulation,"This course examines the international business, legal and regulatory environment. Topics include international legal comparisons, the international sale of goods, imports, and exports, technology transfer, intellectual property protection and forms, and regulations of foreign direct investment."
MET,MET ML 565: Food Marketing,"The course applies the fundamental concepts and tools of marketing and brand management to the food industry, with a particular focus on the burgeoning New England culinary scene. This class will focus on marketing throughout key stages of the food-to-table supply chain, from raw ingredients and processing equipment in early production stages, through immersive culinary experiences targeted to distinct consumer segments. An additional emphasis of the course will be on marketing food products vs. services, and the strategic challenges and strategies that each portion of the food industry requires."
MET,MET ML 610: Special Topics in Gastronomy,"Sergio Arau's controversial film A Day Without Mexicans imagines the United States emptied of Latino labor. Beyond the utter chaos that follows, one thing stands out: we would starve. US-based Latin American or Spanish-speaking peoples, today grouped under the term LatinX, are a fundamental force in the US food system. This course explores the US food system through the lens of LatinX experiences. We start from an understanding of the history of people and mobility in the Americas, then focus on examples of food production and consumption. Case studies will range from Central American laborers in Vermont dairy farms, churro stand operators in the NYC subway, and digital nomads in trendy neighborhoods of Mexico City. Students will prepare final projects that support their understanding of their own role in this food system. If your interests gravitate around American history, immigration, (inter)national security, supply chains, food economics, labor rights, food marketing, specialty agriculture or commodity production, and social justice, this course will aid you in researching multidisciplinary responses to questions such as: ""From whose farm to whose table?"""
MET,MET ML 611: Archaeology of Food in Ancient Times,"How people have obtained and processed a wide range of foods through time, beginning with early humans. Food used by hunter/gatherers; changes in diet and nutrition through time to early farmers. Examines archaeological evidence for types of plants and animals exploited for food, as well as human skeletal evidence for ancient nutrition and diseases related to diet and food stress. Consideration of early historical periods, especially in terms of how certain foods such as wine have played a significant role in culture beyond basic dietary needs."
MET,MET ML 612: Pots and Pans: Material Culture of Food,"Exploration of the food cultures and technologies through material culture- pots, pans, and utensils. Course will range broadly across cultures, time, and space with emphasis on medieval and early modern times. Life histories of humble, overlooked, everyday objects associated with food preparation and consumption; kitchens from prehistory to the present; tradition and fashion in cooking & dining vessels; pots and cooking technology; pots as metaphors & symbols."
MET,MET ML 613: Debating Diet,"Fat, first of all, is an essential nutrient: our bodies require it. Over the years, notions have changed as to how much fat and what kinds of fat should be consumed. A great variety of fats is found in food. These fats, as ingredients, contribute to the unique tastes and qualities of dishes and may be central to defining a cuisine, e.g., olive oil. Fat is also a component of our bodies; the body produces fat and draws upon it as a reserve of energy. The question of how much bodily fat we ought to have is of concern from the standpoint of medicine and public health, given the association, albeit incomplete, between obesity and Type 2 diabetes. Fat contributes both to body shape and body image, and we may try to exert control over the shape of our bodies. Thus, oddly twinned with the obesity epidemic is something of a diet epidemic. These and other issues will be explored through reading, film, class discussion, presentations, and written reports."
