college,title,description
MET,MET CJ 705: Threat Assessment,"Threat assessment is a systematic strategy for identifying, assessing, and preventing potential violent incidents. Using an interdisciplinary approach combining insights from criminology, law enforcement, psychiatry, and psychology, behavioral threat assessment is designed to provide alternatives to violence before an attack occurs. In this class, students will learn the principles of behavioral threat assessment and explore ongoing developments in the field by reviewing case examples and studies of school shooters, mass murderers, lone actor terrorists, as well as more common offender types such as domestic violence offenders. The course is intended for a wide variety of law enforcement officers, mental health practitioners, school administrators, workplace managers, and public officials who are charged with maintaining community safety."
MET,MET CJ 710: Applied Digital Forensic Investigation,"This course is designed to engage students for conducting successful forensic examinations of digital devices and computer networks with hands-on-experience within the Virtual Security Lab. The course introduces EnCase forensic software, which has received the high acceptance rate in a court of law as an expert witness. The course aims to cover various cybercrime topics and digital forensic investigation practices using digital evidence samples. In the process of learning, students will explore the nature of specific cybercrime and be able to successfully analyze and document the digital evidence related to the crime."
MET,MET CJ 711: Planning and Implementation,"This course will introduce you to the concepts of criminal justice policy and planning. You will be introduced to two major theories of planning and apply them to criminal justice settings. Additionally, you will learn the techniques for analyzing problems, developing programs and policies resulting from problem analysis, along with program and policy monitoring and evaluation."
MET,MET CJ 720: Trauma and Crisis Intervention,"Trauma and Crisis Intervention examines the psychological impact of trauma on individuals and society. This course will address the important role trauma plays in criminal justice settings, providing a practical understanding of trauma and trauma informed care. This understanding will serve to benefit practitioners in this field. The course will cover key issues in trauma and crisis intervention, addressing both theory and practice. The course examines the social, cultural and political environments in which trauma, trauma research and treatment occur. This course provides an introduction and overview of the field of traumatic stress studies including the nature of trauma, responses to trauma and treatment for disorders of traumatic stress. A variety of traumas will be examined (childhood abuse and neglect, ongoing and complex trauma, interpersonal trauma, international trauma, etc.) In addition, trauma will be explored in a variety of contexts. Students will gain an understanding of the impact of trauma and crisis intervention both within the United States as well as globally. The capacity to foster resilience in survivors as well as the importance of self-care in reducing vicarious trauma will be stressed."
MET,MET CM 739: Principles of Search Engine Marketing,"In this course students will become familiar with the basics of Search Engine Optimization and Search Engine Advertising and how these new rapidly growing areas fit into the marketing communications planning process. The course will cover topics such as how search engines work, how users search, how to optimize a website for search engines, how to develop a Search Engine Advertising campaign and how to measure success. At the end of the semester students will present a strategically executed Search Engine Marketing plan. Prerequisite for the course is MET CM 719, Interactive Marketing Communication or permission of the instructor."
MET,MET CM 744: Design and New Media,"Provides knowledge and practice for effective graphic design for all media. Develops a foundation in design principles and software skills including Illustrator, Photoshop, and InDesign. Students create projects demonstrating how graphic design is used to engage an audience and enhance comprehension of all forms of mass communication from traditional print to new media."
MET,MET CM 810: Directed Study,Prereq: Consent of advisor. Requires prior approval of student-initiated proposal. Independent study on special projects under faculty guidance.
MET,MET CS 101: Computers and Their Applications,"For students with no prior experience with computers. Organization and function of computer systems; application of computers in today's society; social impact of computers. Introduction to algorithms, various types of application packages, and the Internet. Not for computer science majors. Laboratory course."
MET,MET CS 200: Introduction to Computer Information Systems,"This course is a technically-oriented introductory survey of information technology. Students learn about basic computer information, different types of business systems and basic systems analysis, design and development. Students also study basic mathematics, software development and create simple Java programs."
MET,MET CS 201: Introduction to Programming,"Introduction to problem-solving methods and algorithm development. Includes procedural and data abstractions, program design, debugging, testing, and documentation. Covers data types, control structures, functions, parameter passing, library functions, and arrays. Laboratory exercises in Python. Laboratory course."
MET,MET CS 231: Programming with C++,"Undergraduate Prerequisites: (METCS201) or instructor's consent - Covers the elements of object-oriented programming and the C++ language. Data types, control structures, functions, library functions, classes, inheritance, and multiple inheritance. Use of constructors, destructors, function and operator overloading, reference parameters and default values, friend functions, input and output streams, templates, and exceptions. Laboratory course."
MET,MET CS 232: Programming with Java,"Undergraduate Prerequisites: (METCS201) or instructor's consent - This course covers the elements of object-oriented programming and the Java Programming Language. Primitive data types, control structures, methods, classes, arrays and strings, inheritance and polymorphism, interfaces, creating user interfaces, applets, exceptions and streams. Laboratory course. Pre-req: METCS201 or instructor's consent. For undergraduate students: This course may not be taken in conjunction with METCS520. Only one of these courses can be counted towards degree requirements."
MET,MET CS 248: Discrete Mathematics,"Undergraduate Prerequisites: high school algebra. - Fundamentals of logic (the laws of logic, rules of inferences, quantifiers, proofs of theorems), Fundamental principles of counting (permutations, combinations), set theory, relations and functions, graphs, trees and sorting."
MET,MET CS 300: Introduction to Software Development,"This course introduces basic concepts in discrete mathematics, computer systems and programming that are necessary for modern computing systems. It also develops analytic and logical thinking and prepares students to take graduate-level courses in software development degree. This course first reviews the basic concepts in discrete mathematics including logic, sets, functions, relations and combinatorics. Then it discusses the fundamental concepts in computer systems such as computer organization, basic OS concepts, CPU scheduling, memory management, process management and synchronization. Concurrently with the above mathematics and systems studies, programming concepts are introduced and practiced throughout the whole course using Python. Restriction: Not for CS undergraduate students"
MET,MET CS 341: Data Structures with C++,"Undergraduate Prerequisites: (METCS231) or instructor's consent - Covers data structures, using the C++ language. Topics include data abstraction, encapsulation, the use of recursion, creation and manipulation of various data structures; bags, lists, queues, tables, trees, heaps and graphs, and searching and sorting algorithms. Laboratory course. Prereq: MET CS231 or instructor's consent."
MET,MET CS 342: Data Structures with Java,"Undergraduate Prerequisites: (METCS232) consent from instructor. - This course covers data structures using the Java Programming Language. Topics include data abstraction, encapsulation, information hiding, and the use of recursion, creation and manipulation of various data structures: lists, queues, tables, trees, heaps, and graphs, and searching and sorting algorithms. Laboratory course. Effective Fall 2020, this course fulfills a single unit in each of the following BU Hub areas: Quantitative Reasoning II, Creativity/Innovation, Critical Thinking. Prerequisite: MET CS232 or instructor's consent."
MET,MET CS 382: Information Systems for Management,"Undergraduate Prerequisites: (METCS201) or consent of the instructor - Computer-based management information systems. Management's role in development and use of computer systems. Planning for a comprehensive information system; role in decision making, case studies."
MET,MET CS 401: Introduction to Web Application Development,"Undergraduate Prerequisites: (METCS231 OR METCS232) or instructor's consent - This course focuses on building core competencies in web design and development. It begins with a complete immersion into HTML essentially XHTML and Dynamic HTML (DHTML). Students are exposed to Cascading Style Sheets (CSS), as well as Dynamic CSS. The fundamentals of JavaScript language including object-oriented JavaScript is covered comprehensively. AJAX with XML and JSON are covered, as they are the primary means to transfer data from client and server. Prereq: METCS231 OR METCS232 or instructor's consent."
MET,MET CS 422: Advanced Programming Concepts,"Comprehensive coverage of object-oriented programming with cooperating classes. Implementation of polymorphism with inheritance and interfaces and in Java library containers. Programming with exceptions, stream input/output and graphical AWT and Swing components. Threads, sockets, datagrams and database connectivity are also covered in this course. Laboratory course. Prerequisite: MET CS 341 or MET CS 342. Or instructor's consent. For undergraduates only. Effective Fall 2020, this course fulfills a single unit in each of the following BU Hub areas: Quantitative Reasoning II, Creativity/Innovation, Critical Thinking."
MET,MET CS 425: Introduction to Business Data Communications and Networks,"Undergraduate Prerequisites: (METCS200) or instructor's consent. ; Undergraduate Corequisites: May not be taken in conjunction with CS 535 or CS 625. Only one of the se courses can be counted towards degree requirements. - Basic concepts of data communications and computer networks; hardware, software, and reference models; TCP/IP protocol suit. Overview of voice communication, LAN, network development life cycle, security, management IT Economic: Total Cost Ownership, Return on investment and IT Project Portfolio Management. Prereq: MET CS200 or instructor's consent. May not be taken in conjunction with CS 535 or CS 625. Only one of these courses can be counted towards degree requirements."
MET,MET CS 432: Introduction to IT Project Management,"This course provides comprehensive overview of IT Project Management and the key processes associated with planning, organizing and controlling of software Projects. The course will focus on various knowledge areas such as: project scope management, risk management, quality management, communications management and integration management. Students will be required to submit a term paper. Effective Fall 2020, this course fulfills a single unit in the following BU Hub area: Teamwork/Collaboration."
MET,MET CS 469: Introduction to Database Design and Implementation for Business,"Undergraduate Corequisites: Undergraduate students can not take any combination of courses from th e list: CS 469, CS 579, CS 669. Only one of these courses can be coun ted toward their requirements. - Students learn the latest relational and object-relational tools and techniques for persistent data and object modeling and management. Students gain extensive hands- on experience using Oracle or Microsoft SQL Server as they learn the Structured Query Language (SQL) and design and implement databases. Topics covered include: the relational and entity-relational models, data modeling, normalization, object modeling, SQL, advanced SQL, stored procedures, triggers, database design, database lifecycle, and transactions. Students are introduced to advanced topics including performance tuning, distributed databases, replication, business intelligence, data warehouses, internet databases, database administration, security, backup and recovery. Students design and implement a database system as a term project. Laboratory Class. Restrictions: This course may not be taken in conjunction with MET CS 669 or MET CS 579. Only one of these courses can be counted towards degree requirements."
MET,MET CS 472: Computer Architecture,"Undergraduate Prerequisites: (METCS231 OR METCS232) or instructor's consent - Computer organization with emphasis on processors, memory, and input/output. Includes pipelining, ALUs, caches, virtual memory, parallelism, measuring performance, and basic operating systems concepts. Discussion of assembly language instruction sets and programming as well as internal representation of instructions. Prereq: MET CS 231 or MET CS 232; or instructor's consent"
MET,MET CS 473: Introduction to Software Engineering,"Undergraduate Prerequisites: (METCS342) or instructor's consent - Techniques for the construction of reliable, efficient, and cost-effective software. Requirement analysis, software design, programming methodologies, testing procedures, software development tools, and management issues. Students plan, design, implement, and test a system in a group project. Laboratory course. Prereq: MET CS 342 and instructor's consent to verify programming coursework. Effective Fall 2020, this course fulfills a single unit in each of the following BU Hub areas: Digital/Multimedia Expression, Oral and/or Signed Communication, Teamwork/Collaboration."
MET,MET CS 495: Directed Study,Undergraduate Prerequisites: consent of advisor. - Independent study on special projects under faculty guidance.
MET,MET CS 506: Internship in Computer Science,This course provides graduate students with the opportunity to seek internships. The chosen internship must be related to the student's specialization of study. Students enrolled in the course will be individually supervised by a faculty member from the Department of Computer Science. This course may not be taken until the student has completed at least six courses towards their master's program. Graduate standing in MS programs offered by the MET Department of Computer Science is required. The internship credits cannot be applied toward the MS degree program.
MET,MET CS 520: Information Structures with Java,"Undergraduate Prerequisites: Prerequisites: MET CS 201, Introduction to Programming (On Campus and Blended); MET CS 200, Fundamentals of Information Technology (Online O nly) - This course covers the concepts of object-oriented approach to software design and development using the Java programming language. It includes a detailed discussion of programming concepts starting with the fundamentals of data types, control structures methods, classes, applets, arrays and strings, and proceeding to advanced topics such as inheritance and polymorphism, interfaces, creating user interfaces, exceptions, and streams. Upon completion of this course the students will be able to apply software engineering criteria to design and implement Java applications that are secure, robust, and scalable. Prereq: MET CS 200 or MET CS 300 or Instructor's Consent. Not recommended for students without a programming background. For undergraduate students: This course may not be taken in conjunction with METCS232. Only one of these courses can be counted towards degree requirements."
MET,MET CS 521: Information Structures with Python,"This course covers the concepts of the object-oriented approach to software design and development using Python. It includes a detailed discussion of programming concepts starting with the fundamentals of data types, control structures methods, classes, arrays and strings, and proceeding to advanced topics such as inheritance and polymorphism, creating user interfaces, exceptions and streams. Upon completion of this course students will be able to apply software engineering principles to design and implement Python applications that can be used in with analytics and big data. Effective Fall 2021, this course fulfills a single unit in each of the following BU Hub areas: Quantitative Reasoning II, Creativity/Innovation, Critical Thinking."
MET,MET CS 526: Data Structures and Algorithms,"This course covers and relates fundamental components of programs. Students use various data structures to solve computational problems, and implement data structures using a high-level programming language. Algorithms are created, decomposed, and expressed as pseudocode. The running time of various algorithms and their computational complexity are analyzed. Prerequisite: MET CS300 and either MET CS520 or MET CS521, or instructor's consent."
MET,MET CS 535: Computer Networks,"Undergraduate Prerequisites: (METCS575) ; Undergraduate Corequisites: Undergraduate students can not take any combination of courses from th e list: CS 425, CS 535, CS 625. Only one of these courses can be coun ted toward their requirements. - This course provides a robust understanding of networking. It teaches the fundamentals of networking systems, their architecture, function and operation and how those fundamentals are reflected in current network technologies. Students will learn the principles that underlie all networks and the application of those principles (or not) to current network protocols and systems. The course explains how layers of different scope are combined to create a network. There will be a basic introduction to Physical Media, the functions that make up protocols, such as error detection, delimiting, lost and duplicate detection; and the synchronization required for the feedback mechanisms: flow and retransmission control, etc. Students will be introduced to how these functions are used in current protocols, such as Ethernet, WiFi, VLANs, TCP/IP, wireless communication, routing, congestion management, QoS, network management, security, and the common network applications as well as some past applications with unique design solutions. Prereq: MET CS 575 and MET CS 201 or MET CS 231 or MET CS 232. Or instructor's consent. Restrictions: This course may not be taken in conjunction with MET CS 625 or MET CS 425 (undergraduate). Only one of these courses can be counted towards degree requirements."
MET,MET CS 544: Foundations of Analytics and Data Visualization,Formerly titled CS 544 Foundations of Analytics with R.
MET,MET CS 546: Introduction to Probability and Statistics,"Undergraduate Prerequisites: Academic background that includes the material covered in a standard c ourse on college algebra. - The goal of this course is to provide students with the mathematical fundamentals required for successful quantitative analysis of problems. The first part of the course introduces the mathematical prerequisites for understanding probability and statistics. Topics include combinatorial mathematics, functions, and the fundamentals of differentiation and integration. The second part of the course concentrates on the study of elementary probability theory, discrete and continuous distributions. Prereq: Academic background that includes the material covered in a standard course on college algebra or instructor's consent. For undergraduate students: This course may not be taken in conjunction with MET MA 213, only one of these courses will count toward degree program requirements. Students who have taken MET MA 113 as well as MET MA 123 will also not be allowed to count MET CS 546 towards degree requirements."
MET,MET CS 550: Computational Mathematics for Machine Learning,"Undergraduate Prerequisites: Basic knowledge of Python or R; or consent of instructor. - Mathematics is fundamental to data science and machine learning. In this course, you will review essential mathematical concepts and fundamental procedures illustrated by Python and/or R code and visualizations. Computational methods for data science presented through accessible, self-contained examples, intuitive explanations, and visualization will be discussed. Equal emphasis will be placed on both mathematics and computational methods that are at the heart of many algorithms for data analysis and machine learning. You will also advance your mathematical proficiency enabling you to effectively apply your skills to data analytics and machine learning."
MET,MET CS 555: Foundations of Machine Learning,Formerly titled CS 555 Data Analysis and Visualization with R.
MET,MET CS 561: Financial Analytics,"This course presents financial algorithms used in applications of computer science in financial decision analysis, risk management, data mining and market analysis, and other modern business processes. The course covers theoretical background on probabilistic methods used for financial decision making and their application in number of fields such as financial modeling, venture capital decision making, operational risk measurement and investment science. Number of financial applications and algorithms are being presented for portfolio risk analysis, modeling real options, venture capital decision making, etc. The course concludes with algorithms for financial risk assessment and presents the security concepts and challenges of financial information systems."
MET,MET CS 566: Analysis of Algorithms,"Undergraduate Prerequisites: (CS341 or CS342 or CS526) or instructor's consent - earn basic methods for designing and analyzing efficient computer algorithms and practice hands-on programming skills. Topics include sorting, searching, dynamic programming, greedy algorithms, advanced data structures, graph algorithms (shortest path, spanning trees, tree traversals), matrix operations, string matching, and NP-completeness."
MET,MET CS 570: Biomedical Sciences and Health IT,"This course is designed for IT professionals, and those training to be IT professionals, who are preparing for careers in healthcare-related IT (Health Informatics). This course provides a high-level introduction into basic concepts of biomedicine and familiarizes students with the structure and organization of American healthcare system and the roles played by IT in that system. The course introduces medical terminology, human anatomy and physiology, disease processes, diagnostic modalities, and treatments associated with common disease processes. IT case studies demonstrate the key roles of health informatics and how IT tools and resources help medical professionals integrate multiple sources of information to make diagnostic and therapeutic decisions."
MET,MET CS 575: Operating Systems,"Undergraduate Prerequisites: (METCS472) and (CS 231 or CS 232) or instructor's consent - Overview of operating system characteristics, design objectives, and structures. Topics include concurrent processes, coordination of asynchronous events, file systems, resource sharing, memory management, security, scheduling and deadlock problems. Prereq: MET CS472, and MET CS231 or MET CS232, or instructor's consent."
MET,MET CS 579: Database Management,"Undergraduate Prerequisites: (METCS231 OR METCS232) or consent of instructor. ; Undergraduate Corequisites: Restrictions: This course may not be taken in conjunction with CS 669 or CS 469 (undergraduate). Only one of these courses can be counted to wards degree requirements. - This course provides a theoretical yet modern presentation of database topics ranging from Data and Object Modeling, relational algebra and normalization to advanced topics such as how to develop Web-based database applications. Other topics covered - relational data model, SQL and manipulating relational data; applications programming for relational databases; physical characteristics of databases; achieving performance and reliability with database systems; object- oriented database systems. Prereq: MET CS 231 or MET CS 232; or instructor's consent. Restrictions: This course may not be taken in conjunction with MET CS 469 (undergraduate) or MET CS 669. Refer to your Department for further details."
MET,MET CS 580: Health Informatics,"Undergraduate Prerequisites: (METCS570) - This course presents the fundamental principles, concepts, and technological elements that make up the building blocks of Health Informatics. It introduces the characteristics of data, information, and knowledge in the domain, the common algorithms for health applications, and IT components in representative clinical processes. It presents the conceptual framework for handling biomedical data collection, storage, and optimal use. It covers the concepts of population health and precision medicine and the information systems that support them. It introduces basic principles of knowledge management systems in biomedicine, various aspects of Health Information Technology standards, and IT aspects of clinical process modeling. Students design a simple Health Informatics solution as a term project."
